Score,Content,Token_count
1,"Tier-1 cities are much bigger, although even tier-2 cities are huge by American standard. Tier-1 cities have more ""conventional"" tourist attractions (think of Los Angeles vs Phoenix), and are generally more ""beginner-friendly"" regarding e.g., payment, hotels, and the language (more people in tier-1 cities speak reasonable English). If you have never been to China and your first experience is a tier-2 city, there might be some difficulties.

I'd say rural areas and small towns in China are also in decline, but the reason might be slightly different than the similar phenomenon in the U.S. The main reason is that most young people there have moved to bigger cities for better job opportunities, leaving the towns/villages half-empty with mostly elder people; in particular, there are fewer people actively farming the land. (I know this is also the case for some places in the U.S., but it happens much faster and on a much larger scale in China.) Another reason — which might be closer to why the Rust Belt is in decline in the U.S. — is that some towns boomed due to natural resources, and once the natural resources are exhausted or used less (due to e.g., switching to clean energy), the local economy just collapses. One extreme example is Old Town Yumen (玉门老城), which used to be an oil town but has been nearly completely abandoned after the government moved to the new downtown; you can see some [eerie videos](https://www.youtube.com/watch?v=Fe0ST-qNP64) online.",242
2,They use WeChat groups from what I know. But you can find older people on every platform. No filtering mechanism + large sample = representative sample. Basic statistics.,28
2,Thanks for the detailed write-up!,5
1,Thanks for the detailed write-up!,5
1,"Among the answers people provided, it seems the wide choice to stick to Tier 1 for the first trip and move out from there. Thanks for the info",28
10,"Well explained, thanks for the efforts.",6
10,"I just followed you. XHS/rednote has been a breath of fresh air from the usual toxicity of tiktok. I plan to stay there if I'm allowed as I never felt connected with anyone on tiktok and it was always like a pressure to please people with comments or videos to get followers and likes. On XHS I can show my cats and I make friends. I plan to share more about my life on XHS and make more friends if I can. It's honestly a great app for connecting with others, learning their cultures and gaining new knowledge.",98
2,"Thank you! I’m really enjoying the experience so far. It has been entertaining watching some tiktokers come through, but everything else I’ve seen about this app has been so warm and welcoming and it’s honestly made me tear up once or twice. 

It’s been amazing watching people kind of just jokingly take North Americans in with their little jokes, like a cool cousin welcoming you to their place for the first time. People have been posting videos about different Chinese towns, and their homes. Sharing little life tidbits. It’s just so cute and I want to stay there forever. 

The cat tax makes me laugh, it’s just the cherry on top of the tree. I’ll post dog pics, promise!",119
3,"Notice to the newbies, be careful what you post. If it's a repost, you get a 24hr time-out. I learned the hard way heh oops.

https://preview.redd.it/6uzgso2m19de1.png?width=960&format=png&auto=webp&s=9beff861ba3634b70f6a7754ceee898f9c099001

I know YouTube is blocked in china, but it's hard to know what you have and haven't seen. Have you seen Uncle Rodger content? 鸡肉炒饭?",51
2,Is it true that they’re going to change the IP for people in America?,14
2,"I created a Reddit community page for us to mobilize. It seems like a good start, no matter what the outcome of the ban!! 
https://www.reddit.com/r/TikTokMobilize/",25
2,"Not to be negative here, but one thing for the americans. Take the minorities issues discussed in rednote with a grain of salt. Most han chinese people do not interact with minorities often, and due to heavy censorship also don't have a good understanding of the actual issues. If you dig in the app a little bit more (requires you to understand Chinese though) you could see some issues minorities are facing such as their native languages being replaced, housing issue etc. More serious issues are even more heavily censored.",90
1,This reads like ChatGPT 😆,5
1,"This is so sweet! Thank you for the in depth thread. I just joined rednote. Would love it if people showed some love and followed or interacted with my contents.

https://preview.redd.it/or7p78w8kade1.jpeg?width=1122&format=pjpg&auto=webp&s=8b7ef1bfe29805ac9dc379e2e0724e4b003c8a8e",31
1,"Is it true they're separating the servers? I'm Chinese American but I grew watching Taiwanese and Chinese dramas. I've been using XHS to improve my reading skills. Many of the videos on XHS have been very helpful, and I even found Chinese traditional art, which is rare to find on Western apps. I heard XHS is separating the servers to my dismay. I feel so sad sad if it's true. 😭 I don't know other Chinese sites or apps I can go to for similar content as XHS. Any tips, please?",91
1,You are so great.,4
1,好用心啊，支持,1
1,My original post has been taken down on RedNote. It’s frustrating because I’ve already self-censored and tried to avoid mentioning the things that are sensitive on Chinese platforms.,28
1,"I feel your frustration over being censored. When I lived in (or visit) China, trying to use the internet is so frustrating. A good VPN is the only way I can get any information there. 

I agree that bridging the cultural gap is always good. War is hell (and stupid) and the more we understand and have empathy for each other the less likely it will be.",67
1,"Hi! Our names are Fiona Li, Yuqi Yang, and Vivian Zhai, and we are PhD students at University of Southern California. We are conducting a research study to learn about your user experience of the RedNote platform. 

We are recruiting individuals who meet these criteria:

(1) must be a TikTok refugee, 

(2) have used RedNote for at least 4 months, 

(3) have shared content rigorously, 

(4) be fluent in English, 

(5) still have access to their TikTok accounts if it is still available and not banned,

(6) located in the U.S., and

(7) can use a computer/laptop during the study (can’t participate if not able to use computer/laptop).

 

If you decide to participate in this study, you will be asked to do the following activities:

1:1 interview with one of us researchers \~ 1 to 1.5 hours 

During these activities, you will be asked questions about:

·      Demographic questions such as your age, salary, location and how you identify

·      Your user experience of RedNote and TikTok

·      Your content sharing, creation, and consumption habits on RedNote

·      Content you view on RedNote

·      RedNote’s functions, such as the “nearby” and general explore function

·      How you connect with others on RedNote

·      How you engage with content

·      Posts you’re exposed to on RedNote

 

Participants in this study will receive $10 per hour of interview, paid with e-gift card. 

 

Here is our profile on USC: Fiona (https://annenberg.usc.edu/phd-students/fiona-li), Yuqi (https://annenberg.usc.edu/phd-students/yuqi-yang), and Vivian (https://annenberg.usc.edu/phd-students/jiaying-vivian-zhai). 

 

If you are interested in participating in this study, please contact us at fionali@usc.edu, jzhai562@usc.edu, or yyang418@usc.edu 

Thank you!

Fiona Li, Yuqi Yang, and Vivian Zhai",269
0,"Chinese here. The people you encounter on Rednote are China's wealthiest groups. You probably don't know that there are still 200 million people in China whose farmer pension is only 120 RMB( $15) per month. And they will just wait and die at home if got some serious illness. These people won't be using Rednote. Some say China's cities  so pretty. that's true. But the reason there are so many new buildings is because government officials and businesspeople can engage in corruption during infrastructure projects, and doing so without Chinese people's consent. Take a look at Chinese people's pensions and retirement funds - you guys don't know how lucky you are.",111
2,Alsoy XHS account is iTz Demon and my cat is my pfp. Feel free to follow me if you want to see a bunch of posts about my animals and life,31
2,i alr followed back🤗,4
1,I heard Uncle Rodger is banned by China government because of the Taiwan problem,14
7,"From my knowledge no…I'm a Chinese living in Seattle, and Red Note just show my address as ""America""",18
3,"I don’t think so. But one thing I noticed is that any content with the tag ‘TikTok Refugee’ now takes much longer to be approved. I tried posting something with that tag, and it said it was under review and would take 48 hours. I ended up editing the post to remove the tag, and it got approved immediately.",59
1,"chinese here, you are wrong",5
1,"Honestly I really don't know where you got such a conclusion from. When I was attending high school in Shanghai, we even had six classes specifically for students from Xinjiang each grade; many celebrities are from Xinjiang; most of the local residents in Beijing are Manchu.",46
1,I wonder what makes you draw this conclusion. What is your evidence?,12
3,Apparently English is not my first language but I’ve tried my best. I could switch to mandarin if you want me to sound more ‘human’,25
1,If you have a Chinese cell phone number it's no problem.,11
5,"Dude. I make it sounds like corruption is all over. 
While ignoring the positives. Like lifting over hunderds of millions oht of absolute poverty. 

Poverty will always exist. Even if you provide free food und housing for everyone, poverty will still exist. Thats just the diverse human nature.",48
1,"Ive been in china (im not american) countless times and these people, the simple ones the poor ones were the ones who treated me the most kind even with my broken chinese. The conditions many live under appalled me and saddened me",42
1,"Yep, but the interesting thing is there are lots of malaysians using the app as well (before the whole tiktok thing)",21
3,There’s people on Tik Tok spreading this narrative. The Chinese people in America are crying about it. Even tho I just saw the Chinese government welcoming America to the app.,30
3,"I think tiktok is spreading a new rumor to scare tiktokers back to that app, well it's what I hope as I don't want to lose XHS and the people I've met. I believe if the people who downloaded XHS just used XHS as it was intended nothing bad would have happened but they flooded the system and treated it like a second Tiktok which it isn't. I also noticed that I'm seeing more Chinese creator content now which I am loving. I am still trying to learn the language so videos without subtitles of either Chinese or English are hard for me to follow but if I understand the context of the video I'll leave a like and comment.",120
1,"They’re trying to get people off of Red note and I think they’re using the app urban legend to do it. These creators get paid good to put out these topics and stuff. It’s like a script is going around and these creators are the front of the line workers for celebrities, politicians, billionaires.",54
1,I posted my cat with the #tiktokrefugee and it was approved immediately!,12
1,I'm Chinese and I don't think I am,8
1,"I get the conclusion from being raised, living, and traveling in China. There are extremely small number of schools that have classes for people from Xinjiang. Most of the local residents in Beijing are not Manchu, I'm from there. And also Mancus is fully integrated into the Chinese society (they don't even have their language anymore), so does it really count?

Am I wrong about the issues minorities are facing in China? People are losing their languages. And issues are highly censored. Say Tibet for example, when people talk about the Dalai Lama, Chinese people talk about him like he's a devil, and fierce enemy of the Chinese government. But the thing is their relationship were not always this bad, and in 1979 there was even a delegation from the government in exile sent to China (and was welcomed very enthusiasticly). Discussions about having Dalai Lama return to Tibet was also active at that time, as he was important to the tibetans. Most Chinese kids have ZERO idea of any of this happened",173
1,"Your English was perfect, like ChatGPT! Mandarin works for me too, buy no need 😉",15
1,"I don't, I'm not from China. Hence, it's difficult to sign up on weibo even though I had an old account from 10 years ago. Now I'm unable to access it because they want a Chinese number. XHS is the only app I can sign up without restrictions and have access to Chinese vids. 😭",55
-2,"You are right, poverty will always exist, but the problem in China is unfairness. Some people get a pension of 15 dollars a month, while others get a pension of thousands of dollars a month. Medical care, education, work, all aspects are unfair. It can be said that China is a slave country built on discrimination.",56
1,Sry I don't get it. What is the relationship between Uncle and other malaysians?,14
1,"don't make RedNote chaos, it is not X",8
1,"If you don't have a Chinese cell phone number it's really very difficult to do, many apps need to bind a cell phone number, but you can sign up for WeChat, Chinese apps basically can use WeChat to log in, and if you use WeChat to log in maybe it won't let you bind a Chinese cell phone number",59
3,FLARNESS。你想要怎么公平？还是说欧美都公平了没有资本家了？是不是只有均分你才满意？国家是复杂运转的机器，你这么懂你真上手治理试试啊。还奴隶呢，不赶紧看看Trump的制造业回流政策，没有工人，没人干活，天价人力。,1
1,It was chaotic before all the americans came in. It's just like this right now because people are curious. The app is toxic af but very addictive,27
1,Oh! I haven't tried that yet! Thank you!!,8
1,不公平来自于权力而不是资本，资本之间是有竞争的，没有权力的庇护，资本家只会讨好客户。说共同富裕的是你们的伟大领袖，enjoy。,1
