Score,Content,Token_count
35,"I wish I had found this out sooner, or my account wouldn’t be banned right now. I was messaging someone “Everyone in the US thinks that communism is evil but everyone on this app is very kind.” I think my mention of communism made my account get banned. I can still use it, but interacting with anyone in any way is prohibited for me. Sigh.",65
9,"1 is the biggest struggle I’ve had. It’s hard to not mention politics when learning their culture. Our governments are so different that even how we get jobs, apartments, etc, seems to be different. And that does not mean bad, it just means I want to educate myself on something google has failed me on.",55
9,"I was banned for what translates as having an ""illegal account"". Everything was going fine, I never talked in comments really, just posted stickers on videos and posted k-drama edits. I can't even appeal it because they're asking for a Chinese residency card. Pretty bummed, I really liked the app. I'd even started to make a few Chinese friends and boom everything gone :(",64
5,"i really hope the US doesn’t decide to ban rednote because it’s such a breath of fresh air. if tiktok was this communal, social media would’ve been a better place to be honest.",33
4,"I'm just there to post cat videos, I've never received so many likes on an app, and everyone  is just commenting pictures of bags talking about stealing my cat 🤣🤣🤣",30
4,[deleted],1
3,you have  no idea what your in for. our people are insane.,12
4,Can I speak freely against isnotreal?? ,6
2,Yes and think I'll keep being a foodie on RedNote. Test this: [https://www.me.bot/quiz/whats-your-label-on-red-note---xiaohongshu](https://www.me.bot/quiz/whats-your-label-on-red-note---xiaohongshu),13
2,[deleted],1
2,Now I'm very curious to try. One question: Can you invite a user you like for a date? (serious question),20
2,"This is so nice, it sounds like Rednote is so polite and well mannered. I worry that some Americans will go there and act like it's just another tiktok and mess up the vibe and make us look bad",39
1,"That you so much for your insight!

I just had one of my posts flagged (video of me being at the White House (US president’s mansion).

Are buildings that reference politics typically seen as iffy territory too? Or is that just my bad luck?",44
1,There are some websites stating banned words on RedNote but they are in Chinese. Not sure if there will be an “official” list in English. As OP said sometimes it’s bad luck too,33
1,I got a community guideline ban. When it did the account check everything came back green. Can I delete the account and start over?,24
1,"Your suggestion is very practical, and I give you a thumbs up.",12
1,Thank you for your thoughtful and helpful post.,8
1,Really love what you say here. May I repost this on Rednote? I will make sure to credit the source.,20
1,Thank you so far I’m loving my experience and interaction on RedNote.,12
1,1,1
1,"# Welcome to Xiaohongshu (Red Note) – The New Home for Creators Worldwide!

With the TikTok ban in place, we’re thrilled to invite creators from all over the world to join Xiaohongshu, the hottest new platform for sharing content and building communities.

**We offer free account registration service to get started!**

**Need followers? We’ve got you covered! Contact us for additional paid follower services.**

Having a large following will give your brand a sense of importance and credibility to all of the people who land on your profile. Think about it. **Would you rather follow a celebrity with 500 followers or one with 100,000 followers?**

Having social proof is everything, and buying followers is one very **quick and safe** way to do that. Everybody does it to get a head start, so why don’t you?

When you have a large following, your potential audience will instantly figure out your importance and existence, and they would want to follow you. This, of course, will lead to an influx of organic followers, which will further help with the growth of your account. **Buying followers is the ultimate shortcut to getting even more followers, likes, and views organically.**

Join the revolution, share your story, and discover endless opportunities to grow your presence on Red Note. Your audience is waiting!

Feel free to PM！",220
1,Sounds like a pro free speech app,7
1,Thank you for good introductions,5
1,Agree!,1
1,"Yes, these topics can be discussed, but should not be over-discussed, especially regarding any rhetoric about overthrowing governments. Of course, don't think that it's just the Chinese government targeting these issues. When the Chinese government establishes laws, companies below simply comply or may interpret certain aspects more strictly at 100%. ",50
1,总结的很好，支持,1
1,Do you mind if I read this in a video and tag “tiktok refugees”. I’d just say that I got this from the rednote sub if anyone wants to read it themselves.,32
1,"Almost no one knows, especially 00s'",6
1,[removed],1
1,"[Little Red Book Community Guidelines](https://www.tumblr.com/xavi5612/772669678313226240?source=share)

Here are the Community Guidelines in English if anyone is worried about getting banned. Just follow the guidelines and you won't get banned. If you don't want to do that, go use FB or Insta",40
1,Thanks for the tips and explanations!,6
1,"Never used TikTok, but recently started making music and trying to gain some exposure. Since the pending ban, figured I’d just hop on Rednote and maybe get a little ahead of the wave. Would having a link to my YouTube in my bio get me banned? I don’t believe you can click it, but you can copy/paste it in the url.",61
1,What about talking about religion?,5
1,I was replying back to back on comments I was receiving on a video and got banned after that spree 😔 it doesn’t give me anyway to verify myself because I don’t have the Chinese ID numbers. I tried using my passport numbers but it was denied.,47
1,"One distinctive feature of China's social media landscape is that expressions of Nazism and racism, no matter how extreme, go largely unchecked by the censors.",25
1,What do they think about Tiananmen Square?,7
1,"I absolutly love the care your people have for the children. I wish we known, or tried to find out, I don't think anyone gave it a second thought. I first found out when an American gave wrong answers on ENGLISH homework! lol Then I started seeing so many unhunged posts from the US, I hope it wasn't a child they were telling what a hard bottom or whatever the term is.",72
0,"You all should quit the app asap!!
Just can’t understand why you all would use a app that could ban a lot of things, with lots of rule
If you enjoy communism just go ahead",35
0,"All these rules for the app is wild, makes you realize we have it pretty fucking good in the US. Why freedom is important. 

Every country has evil higher ups",30
-2,"bro uses 10 paragraph telling people the correct way to talk politics 💀

I can tell censorship is a problem in china",22
-1,"Bull shit. Just post a photo of Xijiping and say whatever you want belove it, then you will be banned permanently",21
-6,Imagine going out of your way and putting in all this effort to self-censor because you can't let go of the brain rot. Some CCP official is probably touching himself to American conformity,33
-4,[removed],1
31,"As a Chinese, I should tell u that most of the Account Bans come from social platforms instead of chinese gov. Cause Chinese laws only provides vague regulations in most cases, platforms will adopt a more stringent review attitude in order to reduce risks.",44
6,"This is my fear. As soon as I said to please let me know if I say anything political because I don’t want to break rules, and the person immediately said they had to go. I felt bad. I guess it’s better to stay ignorant in that regard 😞",49
2,You should try to petition the ban & see if you can get it undone,15
2,And now you know how it works. This is the “freedom”.,11
2,"""As a Chinese?""ok,as a chinese.Let me tell you that the system of online platforms is implemented under government control.",19
1,"As a Chinese, I should tell u that although the government provides only vague censorship guidelines, platforms face the risk of being ordered to rectify issues or even being shut down if they host too much content that the government does not allow (for instance, something that is true but prohibited). Moreover, all platforms must obtain a specific license before enabling user comment features. As a result, there are hardly any small social media platforms in China, and large platforms tend to enforce the strictest censorship policies.",87
1,Has that changed your opinion on communism?,7
9,You might be interested in reading Roland Boers Socialism with Chinese Characteristics: A Guide for Foreigners,16
9,"Other platforms are much more open on politics like Bilibili (like a Chinese Youtube) or Douyin, but Rednote tend to be more relaxing and friendly. Though I have to say platforms that are open to politics often tend to be more aggressive and chaotic.",44
2,And they don’t even know what is Google and their search results is not the same from the entire world,20
1,What do you want to know about China?,8
1,"It's completely normal to have a long conversation about stuff in China without mentioning anything political. Chinese people have no political power whatsoever, so politics is just not a part of life.",32
1,[removed],1
4,"Can I make friends with you? I am Chinese. My English is not good. I am learning English. The world is so big. I want to feel different, different perspectives, different scenery or different stories.",35
4,"This happened to me too. I was also told I had an “illegal account.” I’m devastated as I was excited to experience something new and fun, but now I can’t anymore. :(",32
3,This happened to me as well! I'm hoping they'll pick up on it or at least someone will contact the CEO about it!,23
8,"a lot of english users are also failing to realize that interpersonal communication is a big rule when it comes to joining foreign apps, respect for the culture is expected. i’m already seeing some highly uncalled for english racist comments, the negativity from tiktok is being brought the rednote. i just hope rednote gets bots that can help report content like that because rednote has become so much of a better platform than tiktok and instagram or twitter right now, at least for me that is.",86
5,Same. I’ve had a few people ask me about the ban and I just told them unfortunately OUR Government is out of touch and thinks China is out to get us. When all they want is cat videos. That seems to be a winner for the answer. Most of them like that one. My cats are getting so famous on there. Within an hr they had over 1k likes.,69
6,This also could be just bad luck. There's a possibility that the algorithm thought you were a bot based on your IP adress. It's quite rare for the server to have this amount of foreign IPs accessing and signing up from foreign countries suddenly in one day. Normally it should be spam-bots attacking but not today though.,57
6,"Unfortunately, you can't. But remember this most accurate guideline: ""Look at the direction of the wind. If there are any countries or things that the Chinese government wants you to criticize, then there is a high probability that those will not be banned.""",43
4,"It’s not that China can’t talk about politics or systems. It’s that we have to treat it differently. If you criticize the United States, I believe you will most likely not be banned. You can criticize as you like. But if it’s the other way around, oh, sorry, you will definitely be banned or blocked.",55
3,"Israel is pretty popular in China because of the economic ties and the fact that China also suffered from Islamic terrorist attacks. Although most Chinese people don't care much about the war, it is not uncommon to see Chinese people cheering for Israel. The two countries also have a lot of military and political ties, especially when it comes to counterterrorism technologies. [Here is a picture of then-President Jiang wearing a Kippah in Jerusalem, Israel.](https://encrypted-tbn0.gstatic.com/images?q=tbn:ANd9GcRGCc-ZX1KL7Xnz9p8GCP1JSfEV2ZgFlAzRgA&usqp=CAU)",75
1,这有什么装的必要吗😂,1
0,看起来是真外宾,1
3,"No worries. We know you have polite Americans and rude Americans. Same here. What we need to do is trying to be friendly and protect this great cyber environment on Rednote. Comments from haters can be reported or deleted by the platform.   
And I saw some rude Chinese people send offensive pm to Americans. We feel Bad at that too. Anyway. There's good and bad people in every place, so there's no need to generalize an entire nation based on one person's actions.",83
1,I haven't tried that before. I think it's best to keep the account if it can be used properly? (only guessing),21
1,Sure! I'm glad the post could help more people.,9
2,They don't promote the buying of followers on XHS/Rednote. Don't listen to this comment,14
2,No problem. I'm glad the post is helping.,8
2,"Your post has been removed because it duplicates content that has already been shared in this subreddit. To keep the community organized and avoid redundancy, we encourage you to check for similar posts before submitting.

If you believe this removal was a mistake, feel free to contact the moderators with relevant details.

Thank you for your understanding and cooperation!",59
1,It will probably get you flagged. They don't like third party app links. I mentioned Spotify in a post and it was removed from the feed of others but I wasn't banned.,32
3,"In China, religious topics can be discussed, but the following points should be noted:

**Legal framework**: China's Constitution guarantees freedom of religious belief, but religious activities must be carried out within the law and must not violate social order or harm the rights and interests of others.

**Religious policy**: The government manages religious affairs according to law, adheres to the principle of separating religion from politics and education, and prevents religious interference in administration, justice and education.

**Social harmony**: Religion should be discussed with respect for different beliefs to avoid sparking conflict or undermining national unity.

**Cultural background**: China is a multi-religious country, with Buddhism, Taoism, Islam, Christianity, etc., and the history and culture of each religion should be respected during discussion.

**Online speech**: When discussing religion on the Internet, it is necessary to abide by relevant laws and regulations to avoid spreading extreme or illegal content.

All in all, religion should be discussed with respect for the law, culture and social harmony to avoid controversy.

This is the answer provided by the AI, and I think it is generally accurate. Additionally, I would like to mention that the majority of Chinese people are atheists, although some still worship ancestors or deities, including myself. Perhaps this behavior can be summarized as a traditional custom.

**Note**: My English is not good, use the translation, hope to help you group",228
2,"If you want to gain more attention, you can share content related to daily life (such as cooking, life hacks), pets (for example, someone mentioned that posting about cats gets a lot of likes and comments), or talents (like singing, dancing), as these topics tend to interest people more.",49
2,"After a long day at work, people just want to spend their free time browsing fragmented, light-hearted, and enjoyable content, rather than engaging in broad, controversial discussions. If such discussions are necessary, Rednote might not be the most suitable platform, and it would be better to shift them to Bilibili.",50
1,It should be the anti-bots mechanism work but it accidentally banned your account. I heard ppl say delete your account then register again would be fine.,26
3,Most of China doesn't even know about that incident. I am a Chinese who was born in China and lives in China.,22
2,"Young people after the 1990s most likely don’t know. Except for a small number of people, they learned about it through family members or VPN.",25
1,"you wont listen anyway, since all you know is likely to be false",13
2,"Look, this is a typical extreme slogan with a hateful tendency. Apart from venting the emotions of the expresser and arousing emotional resonance, it has no meaning worthy of in - depth discussion, because the atmosphere created by such a slogan is itself a form of brainwashing technique.",48
1,"But this is JUST an app about normal life since it was born, why are you being so sensitive",19
8,"It can be shortened into three actually, but I'd really like to also introduce the history our Internet and what we've been through. We had moments like the current US network.

Lies, hatreds and rumors spread by big companies. It's just you have to find a way to stop them destroying everything you can believe.

I admit there are censorship from our gov now, but hell it's still way better that the only rule is to be ""polite or get banned"" than ""you have to support certain ideology that pops up in a daily basis otherwise your identity will get blown on internet and lose your job immediately"".

Also, there are places that you needn't to be polite like Tieba (something like Chinese version of Reddit). There you can swear people, the gov, the everything in the world as long as the mods leaves you be. It's just Rednote is a place for people who looks for relaxation and peace in mind. Don't bother them if you really do wanna talk about some serious political topics.",176
1," 10 paragraph is only a tip of the iceberg. As a journalist working in Chinese media platform, I could say  media regulations/censorship is tightening its grip every moment.",28
1,Remind me again..who's banning tiktok again?,6
2,"You are beginning to discover how the ""Chinese Internet"" works. We can only express it by ""modifying words"" or ""homophones"" every day. But now those words have become banned words.",30
8,"Honestly, I don't think these points as ""self-censoring"", but more like ""how to speak rationally"".

I don't see the point why ""don't talk politics aggresively"" or ""don't support drugs"" are some kind of self-censoring hell.

Secondly, I've been using English and Japanese social medias for like almost ten yesrs since I speak both languages, and I feel every country has some sort of censoring. People get banned in America in a light speed for supporting Palestine and Russia, and they even would lose their jobs for that. But you don't get banned in China no matter you're supporting Israel or Palestine or Ukraine or Russia, literally. Sometimes I really don't know which side has the so-called ""freedom of speech"" honestly.",120
7,"What's funny is that you never saw the full video and never know how the incident begins at all, yet you still act like it happens right before your face from some bs liberty media.

There riot was mixed with groups of gangsters , robbers and spies. Western gov was trying to make China a second Arab. 

Innocent people were robbed raped killed in that riot by those ""libertarians"", and they somehow turned into heros?

Then who would speak for those poor souls who just wanna live their life with their kids? Who would protect their familily and children that were left alone? Who would put those murderers and killers that participated into jail? 

You? 

Get yourselves a real president through your proud democracy before you comment something like this next time.",132
1,"TS 1989

Is it in reference to a Taylor Swift album or a flagrant human rights violation?

Trick question, they're one and the same and likely both frowned upon",29
6,"Ok but like...that's the law working as intended. 

This happens in the US too. In Florida they purposefully wrote vague regulations surrounding LGBTQ+ topics and because nobody knew how the law would be enforced/interpreted schools just removed all books discussing LGBTQ+ topics. 

It's a feature not a bug that the companies censor so heavily. And it shifts the blame away from the government and onto individual companies.",67
1,[removed],1
0,Asking what might get your post censored is the quickest way to guarantee a ban.,15
1,Do you know how to appeal the ban?,8
5,So? Tell me one big online social platform that can literally get away from the control of local government.,19
2,"Then why there is never an official ban of the EA game Battlefield 4 but you still can't livestream or post any clip of it on Bilibili and other major websites? It's just because these websites don't want to go into trouble caused by vague regulations issued by government, so they stricken the censorship themselves to prevent that. In another word, the government sometimes could tolerate few things but sometimes not, so the media platform just ban everything __they think__ that could disturb the government while actually gov don't give a cr@p about.",93
2,Thank you for the suggestion!!,5
6,"Bilibili is literally a pinkie pool of capitalism hating, anti-feminism, and Jew conspiracies. I would not recommend it to foreigners. Even Douyin is way better. Bilibili is male-centered and its current user base is basically and the China's version of a Gen Z conservative, Mao and Elon loving crowd. And gamers with the mindset of Asmogold. Kinda crazy how bad it got after 2022",64
2,That’s my biggest fear. I’ve been warned from Bilibili in the same way we warn people of twitter,18
1,我都不敢想真去B站他们的私信会是什么样...我都已经在小红书看到装女人要图的了...你指望B站...,1
3,"Not sure what you mean. I’ve tried to learn a lot about China and other countries, but nothing is better than from the people themselves.",25
4,"> My English is not good.

First way to get good at something is to practice, and your English is a LOT better than my Mandarin is!",27
3,It's weirs the direction of the wind even on TikTok... It makes look reddit like a paradise of free speech... NGL...,21
1,"I don't have anything bad to say about China, and that's not my goal at all... I was wondering about those those others bastards and the USA...",27
3,"In the fact , the majority of Chinese people harbor significant hostility toward Israel and Jewish people.",17
1,"That's not true indeed, especailly after what has happened in Gaza",11
3,"https://preview.redd.it/obddqcl7r2de1.jpeg?width=1179&format=pjpg&auto=webp&s=4be65efea70c19d7cb80f2c3f16b35309acb643e

I don’t think that is an option anymore. There is no longer an appeal button either.",17
1,"Well hmm. Hard to gain followers if I can’t link my profile. I just started making music, so my following is basically zero. Never gonna be famous, but it would be cool to find the people that will enjoy it.",40
1,"oh they do know, they learn about it, maybe you didn’t go to school",14
1,"Yeah, I wonder why they don't know 🙄 not like it's been censored and denied to death by their government or anything.",22
1,Free Taiwan 🇹🇼 go away CCP bot,7
2,"You could try say so on the Rednote and see what they will do, enjoy your freedom there. I am a heavy Rednote user and I found it’s helpful too, but I know what CCP is and I know it’s full of fake contents and many brain rotten concepts and contents.
Oh but TikTok is brain rotting as well, so….well",60
2,"And don’t worry they are just now recruiting English censor workers to set up new keywords to ban, or soon enough they will find a way to separate the overseas user and the local users, as the people inside the wall should not be easily in touch to the outside world, like they could never use Google those",58
1,"Maybe you don't like hearing this, but everything he said is true.",12
0,"It’s never just an app, it’s a tool, it’s a platform to shape everyone’s thoughts and mindset, we should be sensitive to everything",23
3,"Agree with basically everything u said, but the Tieba part is not quite true, the overall censorship on Tieba is almost as strict as Rednote, but in different aspects/topics. 贴吧系统删帖尺度真不比小红书宽松多少吧👀",30
2,Free Taiwan. 🇹🇼,3
1,"gotcha, i was just saying, no offense",7
1,Our govt sucks doesn't mean theirs is great,8
1,China . And they also banned most of western social media platforms,12
3,"Can you write something anti-China on Rednote?
Because you can write anti-American things on tiktok.",15
1,Then can I state that I support ROC in rednote?,10
1,"I mean...
https://www.youtube.com/watch?v=3ZxjV0s2CrA",3
1,[deleted],1
0,[removed],1
2,I will avoid it as much as possible just to be safe.,12
1,"Not certain, it probably has the option wherever it says youre banned tho",13
1,You can curse modi online in india.,7
1,"Control is not wrong. Control within a reasonable range is correct, but what about excessive control?",16
2,"There are many games that involve violence or pornographic content and cannot be live broadcast on these platforms. This is normal for us. Of course, I am not a game anchor, and I don’t know which games cannot be live broadcast. But don’t think of bilibili as Twitch. You need to According to the so-called ""platform rules"", you can't live broadcast whatever you want.",64
2,"Ofc, you might also be interested CGTN which has lots of documentaries on China and tells a lot about Chinese culture. [https://www.youtube.com/@cgtn](https://www.youtube.com/@cgtn)  Highly recommend",24
2,I completely agree with what you said,7
2,That is quite true.,4
5,"Well, to be honest, I think Bilibili is still...much more friendly than Twitter I guess, for most of the times. At least the Mandarin section of Twitter has really been a mess.",32
