Score,Content,Token_count
1,Are selfies okay?,3
2,I just uploaded a song cover 10 minutes ago and already have 75 views 🤷‍♀ did you use tags?,19
4,"Thank you! I have to wait until tomorrow because I tried too often, but this helps immensely!!!!",17
4,Ugh my wifi was already off and it still wasn't working 😩,12
1,I have been trying to use it on my iPad. It won’t let me add my cell phone number.,19
1,I tried that. It didn’t work.,6
3,You need to move the slider under the picture to rotate the circle to align with the rest of the image. Don’t click on the image or circle itself,29
2,"Move the slider. It doesn’t look like a slider, it is just a right arrow.",15
3,"I already had wifi turned off and it still wasn't working 😭 I think I'm just now starting to get the verification codes from 90 minutes ago though.

I didn't realize I could max it out, I think I'll wait until the middle of the night to try again. And good for you for already having a video! I gotta get one up ASAP- I took TikTok for granted but now I'm gonna post more than twice a year lol 🤣",81
2,"I struggled for a while with the phone authentication.  I finally got it to work around 8:30pm last night. The text back to me for the code was very inconsistent and I tried to send it maybe 12 times - and only got codes twice.  Def seems a little buggy, but maybe try at different times.  I think/hope if you're persistent, you should find a slower moment and maybe it will work.",72
2,"That worked, thank you. One more question; what are the password requirements? It’s cut off on my phone. It says to use English letters and numbers and I’ve tried to combination, but I keep getting an error message so I assume I’m missing something. I added some characters, but that didn’t work either. Sorry to be such a pain. I’m old😂",61
3,Same here! Hope to meet up with you over there!,10
1,Do I just 1 and the area code and the number?,11
1,"Try keeping the password to 8 characters, use letters and numbers, and also try special characters like ! And ?. Don’t know if that will work though.",27
2,"If you are in the US, you want to select “America” from that drop down (it should be the 1) and then type your normal area code and number",29
1,Thank you.,2
38,"hahahaha so funny you say reddit is an anti-china platform in general, i agree, and you will get downvoted into oblivion for saying anything positive about china in the main china sub. thanks for the rundown. yes the boise idaho chinese do not have that much to post about LMFAO",50
20,"I agree! I'm actually Taiwanese but instead of growing up in Taiwan, I was raised for some years in Mainland China (because both my parents have family in Mainland China too) before my parents moved all of us to English speaking countries (we're expat kids) for their jobs.

I definitely agree that Xiaohongshu is a primarily an app for middle class to rich AF people to showcase their lifestyle in primarily tier 1 or tier 2 cities, some in tier 3 cities as well. And I agree with the rest of your points as well, with the exception of point no. 6 because I think both Xiaohongshu and Reddit can get pretty toxic, like other social media platforms.

Tbh, I primarily use Xiaohongshu to keep in touch with my cousins in China as well as to use its search engine for looking up all the things I like and also.... for art inspo, for yummy recipes and for shopping/fashion/makeup recommendations/tips. 

Xiaohongshu basically taught me how to cook fr because my own mom was never patient enough to teach me and my Chinese grandparents.... don't explain things well (like when my grandma says ""Put a little bit of soy sauce"" she actually meant pour in a good splash of it. Or when my grandma says, ""Steam it for just a moment"", she actually meant steam the dish for a good 30-40 minutes)",231
5,"Seeing that we get polar opposite opinions of China. It's time to take a trip and check it out for myself. Considering the misinformation the Chinese are presented about the US, I need my own opinion.  

One person told us that they were told the medium income for Americans is 1mil. LOL! So forgive me for not believing your assessment and passing it off as propaganda.",66
3,"Thanks for posting that! I think being given even a glimpse into each other's world and daily life, of course it has good and bad elements, is something cool, and an unexpected opportunity to learn together. I am richer in understanding for the experience. I have been watching my wife, a TikTok Refugee, scroll through Rednote since the ban. She shows me all the beautiful things she finds, and has learned some Chinese words. Thanks Rednote users, for making her feel welcome.",82
3,"


This is a very interesting post and I like the points you pose. I can share experience and thoughts on a few of these from the mostly typical American perspectives.  Mileage may vary.

Metropolitan areas like Portland and Salt Lake City tend to have more college-educated individuals due to diverse professors and coursework. Higher education broadens perspectives, while rural areas often prioritize trades, agriculture, and family life.




In places like Ohio, the lower cost of living and fewer high-paying job opportunities reduce the emphasis on higher education. Life revolves around tight-knit communities—family, friends, and neighbors—rather than meeting people from across the world. The focus is on maintaining strong local connections, not expanding global perspectives.




Reddit has its fair share of contrarians who love to argue but hate being challenged, creating endless echo chambers. Political divides have made this worse, and while Facebook has similar issues, 4chan is the bottom of the barrel, fostering extremists and incels who blame women for their loneliness. That said, Reddit isn’t all bad. There are still great subs like RedNote, animal rights activism, photography circles, and small animal care communities that make it worth staying.




Extreme wealth is shoved in our faces daily, while the lower middle class is ignored. Wealth equals morality, which is completely backward. One of the worst offenders? “Tradwife” influencers—privileged housewives in designer clothes, whipping up homemade gummy bears in spotless kitchens (definitely maintained by a maid) while preaching submission to husbands. These women ooze privilege, dragging their unschooled kids on voluntourism trips just to exploit village children for Instagram Likes. It’s as fake as those staged animal rescue videos where they “save” the creature they just put in danger.




As a stay-at-home mom, my reality is vastly different. Most of us don’t have the financial luxury to stay home, and for autistic parents with autistic kids like me, keeping a job is even harder. That means getting creative with expenses. At least Reddit has decent moderators who delete the worst content, and I’m grateful for platforms where activism can still be shared—especially since access to real resistance news is becoming harder to find.",353
4,"Rednote = china ig
Douyin = china tiktok


Am i rite?",11
2,不友好，要用reddit太困难了，发什么都删，还经常评论不了，已经是熟读每个subreddit的规则了，发啥都被隐藏,1
2,"Would you be willing to expand on your statement about RedNote only showing the lives of a small subset of Chinese? What would be the differences in a 'normal, everyday' person's life?  I'm asking sincerely and respectfully. Also, what are the differences in the tiers of the cities?  Thank you so much!",52
2,"You know what, as a local Chinese guy I used to think Rednote was full of just some dumb girls. I even thought to myself, maybe I could sell them something, make some money off them. But then I realized, I started getting hooked on the app myself, spending over two hours a day on it. Turns out, the joke’s on me.",62
2,"tier 1, new tier 1 & 2  ....is around 400 million ppl in china.  It's 1/3 of china and basically 60% of china's urban population.  Alot of hot dads I follow aren't from shinghai, beijing, but from places like guangxi, jiangxi, zhejiang, xinjiang.  So not necessarily the richest places, but mainly urban.  It's an app for urban young ppl, similar to instagram.  You ain't gonna get your MAGA rural farmer posting on instragram neither.  The difference is america has a larger urbanized population.   The rural village life is basically farming or local mom and pop shop business.  there isn't much going on to show off.",105
2,"I love the arts and crafts. So many amazing artisans, I dream of making things as beautiful as a lot of these folks. And the food!",26
1,True.,1
1,"I also thought point #1 was the case, which is why I am confused as to why there are so many americans on the app who have made it their mission to convince the app users that the US is a desolate wasteland. Not saying they probably aren’t interested to a certain degree, but do we really think they care that much? What are people getting out of this. I don’t necessarily disagree with what’s being said but I wonder why this message is being shouted at people who are relatively well off.",93
1,What is the most popular name on rednote?,8
1,XHS is the chinese bluesky,5
1,Yes this is the thesis behind rednote. Lower tier cities and working class use a different short video app.,19
1,"Are there any other Chinese apps that reflect china more broadly 
?",12
1,"Thank you for sharing your perspective on rednote aka xiaohongshu. Based on my observations over the past while, i’ve found that rednote is generally a calm, positive, and supportive social platform. of course, like any social platform, there are also unfriendly or ""bad” people, but that’s something you’ll find on every social media platform.

From what I’ve seen, rednote user base seems incredibly diverse. It has white-collar professionals and wealthy individuals from magecities like shanghai/beijing/shezhen, working-class folks and everyday people from smaller 2 or 3 tier citys, and farmers and herders from rural areas, as well as a ton of artists, craftsmen, and many china minority content creators. This diversity has been really surprising to me. After tiktok ban, there're also a lot of users from the US, Europe, and Africa, which makes it like a global village.

I’ve also noticed that many rednoters mention the search function in there. many brag it is excellent—in some ways, after i tried, i feel it even better than google or bing, especially for solving everyday life problems or giving travel tips. AIA rednote is full of practical, experience-based answers that feel very human and relatable. Speaking of Google, I’d like to clarify that google isn’t blocked/banned in china. From what I understand, google chose not to store its data in China, which is required by Chinese law, so its services aren’t available there. However, google’s commercial advertise services are remained and very profitable in China. so, it’s not accurate to say that “google is blocked or banned by china.” as far as i know, bill gate’s Bing and apple iCloud operate just fine in china.

As for how rednote users view other social platforms, I cannot speak for them but from what i observed, i'd say they’re pretty neutral overall, actually you can find lot of  posts discussing these topics; as long as it serves a specific need or purpose, chinese users will use it. reddit, for instance, doesn’t have many users in China, which might be good since reddit’s content, especially when it comes to chinese people and politics, often carries the typical Western biases and political correctness. but honestly, that’s not a huge deal—who can claim to be completely fair and impartial? Time will tell the full story.

At the end of the day, rednote can be seen as a small window into knowing china and its culture etc, as well as a place to discover interesting contents from all over the world. From that perspective, rednote is a great choice.",421
12,r/china is one of the worst non-4chan places on the internet,11
2,"Interesting! I did see several posts of people showing their homes (apartments, I suppose). They would all throw around huge numbers, but a similarly priced home where I live won't get you much (I live on Canada's West Coast), and yes, I converted from Yuan to CAD.

I enjoy cooking, and there are a few people I follow to learn how to cook Asian dishes (though my partner and ex are both Korean).

Mostly I'd like to better understand Chinese lifestyle from someone living there as such there are several (what seems to me as down to Earth) Chinese and non-Chinese who are American or other nationalities I like to follow.

I guess the Western media has ingrained how bad China is, so we all go in with preconceived notions and are always skeptical. But so far, everything feels authentic, but you take it all with a grain of sand.

Several mentions of toxicity - I guess I haven't found those yet - but if ""flexing"" is considered toxic, then yeah, I've seen quite a bit of that. But other than that, I haven't run into anything truly toxic.

And like TT, a lot of thirsttraps and some incredibly attractive people.

I love hearing what Chinese people think of the RedNote platform, though, and sharing their views. It does help balance things out.

So far, I really enjoy doom scrolling.",230
5,You won’t get any useful info just by going to major cities since China has an extreme urban/rural divide in terms of wealth and quality of life. But if you can’t speak Chinese it’s very difficult to navigate the more remote parts to say the least.,46
0,"I can’t believe how many Americans assume that what they read in newspapers about China is propaganda, yet they’ll go onto a heavily censored Chinese social media platform to “learn the truth.” The stuff reported in your newspapers is basically the tamest version of all the bad things happening in China. Foreign media has extremely limited freedom to conduct interviews or investigations here, so they have no other way to uncover reality especially when the CCP is so effective at controlling the flow of information. Those of us actually living in China see and experience the most messed-up realities every day. Many Americans are blinded by their dislike of their own government and then make so many ridiculous conclusions. If you really want a deeper understanding, you’d learn far more by talking to a few middle-aged Chinese immigrants than you would from spending ten months on Xiaohongshu. Enjoy Xionghongshu as much as you want but don’t consider it as the “truth”",161
6,"Yes, Douyin is quite literally the Chinese version of TikTok (both owned by BydeDance), whereas “RedNote is the Chinese version of IG” is more on the metaphorical level",28
6,"Tier-1 cities: Beijing, Shanghai, Guangzhou and Shenzhen

Tier-2 cities: Chengdu, Nanjing, Hangzhou, Tianjin, Wuhan, etc. (\~15 cities in total)

Basically tier-1 cities have a strong international element (more foreign companies, more foreigners living there), have better education and public health, and the cost of living there is much worse. In the U.S. tier-1 cities would be NYC, LA, Chicago, San Francisco and DC; and “strong tier-2” cities would be Boston, Seattle, Philly, Houston, Dallas and Miami.

RedNote users are mostly young white-collar workers in tier-1 and tier-2 cities, and ~~screw~~ skew female. This means that their purchasing power (real or fake) is much higher than other Chinese people, their social views are generally more liberal/progressive, and their lifestyle is generally more bourgeois. So most rural people, and even people in small cities, as well as the elders, are marginalized there (which tbf is the case for Chinese social media, or perhaps social media anywhere, in general) — although you can see some posts on RedNote about rural life if you intentionally search for such contents. And as I wrote in point (1) in the main thread, RedNote just has a much more pretentious vibe.",194
1,Rednote has 300+ million users. The population of China 18-64 is ~800 million. If you know elementary statistics then sampling 1/2 of a large sample in the absence of a filtering mechanism like a paywall means you have a statistically representative sample.,42
1,"I wouldn’t specifically break it up by cities. It’s a lifestyle app akin to Pinterest and IG. You can definitely find popular people posting from all over China. There’s no shortage of rural creators who don’t come from wealth too. But the common denominator is that romanticizing life is going to get the most engagement. People browse red note for aspirational content and escapism. So if it’s content from the countryside, expect Liziqi style rural beauty, natural landscapes, and crafting videos",81
2,"I think part of this is the app was downloaded and used so heavily by Americans who were so addicted to TikTok that they downloaded the first thing they were told was similar. These are not the most intellectually curious people - these are people who spend hours every day staring at a screen and moving a thumb. 

Also, these people seemed to be amazed at photos of buildings in China. These people could have googled this stuff at any point they wanted. They could have downloaded RedNote before TikTok shut down. They could have gone to their local library and checked out a book written by a Chinese author. They could have done *anything* if they were curious enough. They didn't want to. 

The 'Chinese people are so nice' thing. Have these people never met a person from China? Why are they so surprised? I went to university with scores of people from China. I had professors from China. I've worked with people from China. How is this their first time interacting with a person from China? That always made me quite sad for those people. I imagine they spend most of their time indoors looking at their phone. Why is this their first exposure to Chinese culture? It's bizarre to me. 

And don't even get me started with how the Americans on the app can't understand the difference between the words 'income' and 'net worth', lol. That actually says a lot about the type of people who use the app. 

Oh, and the people who say, 'my government told me that xxx is in China, but now I see it's not true on RedNote'. First - I don't think these people listen to anything but social media in the first place, so whatever perceptions they have of *anything* is probably shaped solely by social media. When I asked them for sources about how their government told them about China, they point me to Chinese state-run media, quotes from Chinese officials, or they can't remember where they heard it. 

I actually feel bad for the Chinese people who are now interacting with these people. It might be entertaining at first, but I think I'd do anything I could to get away from them after a while.",377
7,"momo, absolutely",2
6,"Yes and the mods will like strike down any China truths that dare leak out there, it's bizarre. but every day somewhere on reddit it's ""how can we rescue the chinese children from the brutal education sector"" like um is this because they're all demolishing you at school stuffs??",49
3,"If you've only seen people sharing how their very regular home/apartments look like and not like.... showing off how many luxury branded stuff they owned then I think your algorithm's just pushing middle-class lifestyle kind of content and not those of the super rich. And that's better actually. More relatable. At least to me, that is.

I mean, I've seen videos of the rich making a trip to Chanel and buying like 10k USD stuff at one go and be like, ""Oh this is nothing. I've spent so much and so much at \[Luxury Brand Store This and That\] before."".... I mean, I CAN NOT RELATE AT ALL. 

Also when I say toxic, I mean like.... sometimes when people perceived you said something wrong or they just didn't like your comment/opinion on Xiaohongshu, they dog pile you. Just like Reddit. 

My first week on Reddit, 2 different people made fun of me when I used ""oh"" in a sentence as a filler word because I didn't know what else to say. A couple more got really sarcastic and nasty when I asked about some English slang someone else commented because English is my 3rd language and I don't always get certain internet speak in English. I had to delete my comment because.... yeah, they were really getting to me.  

That said, you can curate what you see on Xiaohongshu a lot easier than other English platforms so not only is it possible to stay away from the toxic and just engage with the positive ones, it's also possible to make sure that it stays that way long term. 

I'm honestly so glad that... well, now people know the truth about China and Chinese lifestyle in general :) 

Have fun doom scrolling! We do that too :)",296
0,Like American propaganda?,3
3,"Thank you! Very good explanation and comparison to US cities. So, I do think that you might have meant in the first sentence of the last paragraph that tier-1and  tier-2 cities skew female...not screw. Although that does add an interesting perspective 😉 

I spend a lot of time in Mexico and am always interested in the culture and customs of other countries.

Again, thank you.",65
3,"Interesting analysis. As a side question, for someone interested on travelling to China, is there any meaningful difference between tier 1 and tier 2 cities, outside of perhaps cost and amount of interantional elements? 

Also, you can probably tell that in the US, many rural areas and small towns are in pretty rough shape and getting worse overall. How would you characterize the situation in such rural/small town China in general?",71
1,"I don't think the US city tiers compare to the China city tiers, because we have different issues with poverty and drugs that aren't quite the same in China. 

Boston is also world renowned for both first class medical care and education. I would put Boston as ""tier 1"" before LA/SF (which are known more for their homeless and drug addiction issues).",62
1,wrong...your tier 2 are new Tier 1 cities...there are also 30 tier 3 cities.  I see ppl from the top 50 or so cities in china.  not just the top 20,31
1," Thank you! So, another question, if I may, and if you know: First a comparison - older Americans (60+) seem to use mainly FB, and some TT. Do older Chinese use social media platforms and if so, for what purpose? Seems like a silly question but Chinese seem (at least to me) to be more tech minded. I'm hoping that is true across the generations.",65
1,Thank you! I don't use IG or Pinterest so I don't really have a reference point. I only downloaded TT two days before it 'took a day off' just to see what all the fuss was about. I also don't use FB except for very specific things I can't get anywhere else. All that non-relevant stuff being said...am enjoying red note a lot. Trying to expand my algorithm so I see more/different things. Thank you again.,76
1,The reality of China is much worse than what you read and thought was “American propaganda”. I’m Chinese and I lived in China in almost 30 years. I go back to China every year to visit my parents.,38
2,"Yes, it should be ""skew"" rather than ""screw"" lol. Thanks for pointing out",13
4,"1. Every city has its own culture and specialty.
2. There is a big gap between rural countryside and urban city, especially in north and west provinces. But our situation is rural places are getting better not worse. Goverment has plan to improve the level of infrastrues and life quality.",50
3,"My perspective as an ABC who visited family in a bunch of parts of China recently!

\-There will be way more foreigners working and visiting in Tier 1 cities, but lots of Tier 2 cities also have many other foreigners at this point. The foreigners in Tier 2 cities (from my experience) will be fewer and generally English proficiency among locals will be somewhat worse though so plan accordingly with a translate app or something

\-If you're from the US, Tier 1 cities might feel more ""familiar"" with more chains, businesses you know, and attractions like Disneyland since lots of Chinese people themselves might travel to Tier 1 cities for an international experience

\-Rural parts lag behind in development but they're trying to improve! I'd really recommend you check out some rural parts because it's just so different and charming, like off the beaten path with locals who seem way friendlier and relaxed than the busy environment of the city. Tier 1 and Tier 2 cities just feel impersonal in my opinion, where everyone just rushes by. The rural towns don't feel like that and it's refreshing

\-Trying the food in rural areas is such a great experience. Lots of it is very directly farm-to-table stuff and it's handmade by traditional means so you aren't looking at some mass produced standardized recipe that's been served hundreds of times. Like most rural homestyle cooking, every dish is gonna be a bit different too so you're going to get something unique!

\-If visiting rural areas, just be mindful that they can be car dependent and public transit isn't going to be as developed so you might have to rely on a car or a taxi often

\-Rural towns like the one where my family originates have practically no English at all and usually no one is conversational in English",307
