Score,Content,Token_count
3,"Politics can actually be discussed, but try not to be too public or direct about it, because you never know if someone might come along, loudly complain, and cause the post to spiral out of control and get deleted. Of course, nothing significant will happen if it gets deleted—most of the time, the police won’t come after you unless you spread rumors that cause a major impact. Still, it can be quite frustrating.",73
2,"The violation of Labor Law in China is more common than u could imagine, though there is Labor Arbitration Committee where you could appeal to, but in practice when labors' right is infringed, it's difficult for them to defend their interests while cooperations constantly tend to damage them.",48
-1,[removed],1
3,"thanks，I plan to spend some time learning English by interacting with English speakers When I “mo yu"".  
(""mo yu""  == ""touch fish"" (a chinglish） ==  'loaf on the job')    
i no idea how to say  ""mo yu"" . Anybody know it 

https://preview.redd.it/ewsoqq7vz9de1.png?width=810&format=png&auto=webp&s=bfb1e7771ecce9c7380cf5454e56023c17497b7d",42
2,I'm not a big reddit user so I don't know. But almost all Chinese platforms have regulations to ban information.,20
4,"fine sophisticated pen coherent languid doll whole middle file fuel

 *This post was mass deleted and anonymized with [Redact](https://redact.dev/home)*",19
2,That's not what I've experienced.,5
5,"Then maybe you could try deleting the account then register another I guess. It's better to wait a couple of days after you deleted it in my opinion. It's still hard to say what the Rednote official will do to these foreign accounts, since the majority of users are Chinese people.",51
1,"I honestly pressed thumbs down buttom and wrote what I wanted to say into a translation app especially being a tik tok refugee after translating my options, too.  I'm hoping that'll do something but I'm also hoping someone would speak up for us.",43
1,You can always record yourself making the music and share tips for creating music for others. That may work to get you followers,23
1,cute that you think the people who know learn about it from school,13
4,"In an environment where information is closed, how do you know? It cannot be searched on the Internet, the media has not reported it, and the history of the school will not be mentioned.",34
3,"You can look at the tens of thousands of demonstrations that took place in Pu County, Shaanxi Province, China last week, where people had physical conflicts with special police. Let me tell you clearly that none of the media in China has reported it. You can search for the keyword ""陕西蒲县"" in X",53
2,"* Due to multiple rounds of online content cleansing, which even removed many normal and in-depth pieces of information, LLM developers have discussed the issue of insufficient Chinese internet data during the early stages of LLM training.
* Websites in China are required to obtain a license to publish content. If your website contains information that does not comply with regulations (even though the rules are not explicitly defined), government officials may contact you, shut down your platform, and impose financial penalties. As a result, website owners tend to cooperate. For extreme content, authorities may even visit your home within 24 hours.
* Keyword censorship: If content containing certain sensitive keywords is posted, it will be directly deleted, and the account may even be banned. This process doesn't require a lot of manual intervention.
* You cannot know about something that ""does not exist."" However, you can search for what you're interested in through RedNote for chinese, and you'll find that it doesn't exist.",164
3,China lives rent free in your head lmao,8
2,Worry about fixing your own shit before you start yapping about other people's shit.,14
3,Yup I literally tweeted at Elon calling him a little bitch crybaby. Wondering if the same can be done over there 👀,22
2,"The thing is, well, did you see the part that I say there might be some fellows on Rednote look like part of White Supremacy? That's it. They simply despise everything about China or being a Chinese and all hail to the Great Western World. There're more on Weibo and Douban. Though I'm still glad that there're fewer of them nowadays.",61
1,"首先那是位找茬的韩国人。其次对方率先不礼貌的话我没有必要以礼貌回应。

尊重是互相的。

First of all that was a Korean fellow looking for troubles with malice.

Secondly, if he/she's looking for troubles, I don't need to be polite.

Respect is mutual.",30
1,"You do realize that these kind of inane comments are exactly what the pro-China shills love to see, right?",19
2,[removed],1
1,Journalists have died doing this in India,7
1,What is reasonable and what is not?,7
2,"Oh boy. I have only seen the kpop side of it, and been told American kpop fans are despised by Bilibili users",22
2,What is the mandarin section of twitter like? And how has it been a mess recently?,16
1,Agreed.,1
3,"It's the first time I hear it but it's an interesting idiom!


""摸鱼mō yú originally refers to the idiom ""浑水摸鱼 hún shuǐ mō yú"" to fish in the muddy water."" 


I guess the best translation would be something like ""slacking off at work"" or ""pretending to work""? 
Since the water is murky, the boss can't see that you're not actually catching fish, pretty interesting metaphor. ",65
1,"So far so good, tho... ",5
2,You are very lucky not to have encountered supporters of Hitler.,11
1,how innocent of you,4
2,It didn’t work for me. I just deleted the account. Got a Google voice number and started over.,18
1,"Yeah I’ve got just a couple clips of some working projects up, got a few likes and follows. I only have one song actually finished with vocals and everything, so I’ll probably add a video of me singing along to it or something. I’m 36 so my desire to spend all my time on social media and getting followers is limited, but I’d like to share my music, so I gotta play along I guess.",75
2,"Fuck Xi Jinping lol, CCP bot",6
1,"Seriously. Generally I'm pro-Elon because I feel like if you can separate the art from the artist he's involved in some pretty impressive stuff, but lately, he'a gone off the deep end since Trump won again. I think he's overstepping given that he himself isn't an elected official and Trump needs to reign him in or else he may hurt things more than he helps.

Imagine saying that about Chairman Winnie the Pooh",73
2,"Seriously? As long as you do not cause any public panic, the worst result u gonna get is a deleted post or a banned account, don't be such dramatic.",29
1,"I’m sorry you have to be so careful, and I hope you always stay safe.",15
1,No lol.,2
1,Depends on which you are from,6
2,Bilibili has a very obvious Japanophile bent. After all it started life as a Niconico clone.,16
2,"    That's awesome. My friends all say what you said is great.

![gif](giphy|tpVKvAabWt3G5csMkT)",12
1,But my conversations keep being deleted by moderators.,8
1,I'll wait it out before I try out any other methods! Fingers crossed.,13
1,Make sure you include Chinese subtitles (simplified) to make it so the original users some of who don't speak English understand your videos,23
1,"https://rsf.org/en/almost-half-28-journalists-killed-india-modi-became-pm-were-covering-environment-related-stories

Literally watch any Indian movie about corruption to understand how horrible our system is. I recommend Jawan",18
2,"No matter where you are, you'll have a hard time finding a proper boundary",14
1,completely nonsense if you cannot point it out,8
1,Here? Or there? What are your conversations about?,8
1,"Super new to the app, is there a button that will add them?",13
1,Let this moderator delete it slowly first.,7
1,There's not. You can use other apps to make the videos. Like for example cap cut you can add dual or bilingual captions to your videos. But they will charge you since it's a premium feature. Personally my posts are just pictures or videos with no words and captions in Chinese so people can understand me. I also use my phone to translate back and forth to communicate,68
1,"Gotcha, thanks! Guess I’ll have to figure something out. Hopefully the devs will get some cross-language features added in the future.",21
19,"thank you so much! this is actually helpful <3 
questions:
i don’t have any followers yet, on tiktok that wouldn’t be a problem to gain views, how is it on xiaohongshu? should i get followers first, then post?",38
11,"Has anyone else been having issues with phone verification? I'd like to be able to comment, but the codes expire within 5 minutes and it's been taking 20 minutes for them to send to my phone",36
4,"Can you explain what to do with the code photo after entering your phone number? I’ve tried dragging it where I think it should go, but it’s not working. Thank you so much.",33
4,for right now really lots Chinese internet users already got news that you guys(American tiktok user) are lots move to rednote. i’m not really sure the app policy or Government policy (both  side country )will not change. but right now it’s really a good opportunity to let you see the different app world whom users mostly Mandarin speaker. i’m sure there are lots kindly and welcome for you.just continue ignore not like and star you like,76
4,"Firstly, the most important aspect is Xiaohongshu's review mechanism. On Xiaohongshu, topics such as gambling, pornography, drugs, and homosexuality are restricted. If these topics are discussed, the account’s posting and commenting features may be limited, and in severe cases, the account could be banned.

Additionally, Xiaohongshu has many restrictions regarding advertising. These are referred to as ""sensitive behaviors."" If content involves things like the claims of health products, directly guiding the purchase of a particular product, or directly recommending a product, and these actions have not been officially reported or paid for, they will be restricted. In severe cases, the account may be banned.

Xiaohongshu provides an official platform for business engagement. Merchants can apply for an official brand account or cooperate through official channels to invite Xiaohongshu influencers to promote their products.

Additionally, Xiaohongshu originally started as a shopping recommendation platform. The users on Xiaohongshu are more focused on life itself. They trust the platform greatly and tend to search for answers to almost any question there.

I work at an advertising company in China. If you're interested in learning more about advertising on Xiaohongshu or need any information, feel free to contact me!",195
3,"I wrote a Red Note (Xiaohongshu) App Guide for Beginners [https://fmoran.me/xiaohongshu-app-guide-for-beginners/](https://fmoran.me/xiaohongshu-app-guide-for-beginners/), which might help people use RedNote. If you still have any questions after reading it, feel free to leave me a message.",33
3,"https://preview.redd.it/jx4o7lt1g3de1.png?width=2896&format=png&auto=webp&s=7e8ebc2b308df59285337d496d2a2128ec03718c

I've created a new tool called [Rednote Preview](https://covertester.ifoz.net/)  that lets you preview how your post will look on Rednote's feed, both in Chinese and English. You can also use it to test if your cover images meet Rednote’s recommended aspect ratio.",42
3,[removed],1
2,you should pin this post,5
2,I'm having trouble getting a verification code to link my phone. What am I doing wrong?,16
2,"Was trying to upload a test video up on the app and got hit with an error 'video size exceeds the maximum limit"" 

I'm assuming this is a data limit (it's an 8k video at 700 mb's) but just wanted to confirm what the maximum file size limit was or if there's an aspect ratio limit that I'm not understanding",60
2,I m chinese live in Canada any issues ask me. I'm very very familiar with red notes,17
2,"Today I experienced hacking while on an official website. I suddenly get this message that pops up in front of my screen in bold pink letters followed by a bunch of pop-up text message bubbles of randoms messages saying things like “how is NYC, or let’s be friends” it all happened so quickly so I wasn’t able to process if it was a pop-up that was part of the website that I was on, but it definitely was not. And then it was gone. 

Part of me feel like this has to do with downloading red note. 

Idk what to do except hope that my private data has not been compromised.",111
2,I love rednote tbh. It's way better than tt and it's not filled with over or underwhelming trends or topics that will send you into a never ending rabbit hole. Everything is like tt except for a few things which I understand because it's not a copy and paste but the one thing I REALLY wish it had was audio saves. And then I'd marry rednote.,66
1,How do you tag products to earn commission as a creator on Red Note?,14
1,[deleted],1
1,Anyone else having issues with downloading the app? My phone will not let me.,14
1,"I already am signed in on the mobile and desktop side of Rednote but I can't seem to translate the desktop/website into English, is there any way to do that or is it not possible at the moment?",38
1,"when i try to tap a tag to see other posts using the tag it doesnt work and says ""function upgrade, not open"" :( anyone know how to fix that?",30
1,Do the content creator there get paid for their posts the way TT does?,14
1,"amazing app

![gif](giphy|YSEFE7h6K0L81wyvg8)",3
1,I want to repost my vlogs that I had on tiktok but I curse quite a bit in them. Is that ok for rednote?,24
1,"📕 2 apps I have been using to help translate! IOT 
1. Instant Online Translate - green icon- has swipe translate with a search scope 🔎
2.  #TranslatePro  - blue icon

If you have an android you can press the middle button and you will have an option to translate screen.

Good luck!",53
1,"Hi! I was going to download rednote but I saw a review saying it collects IMEI numbers, is that something I need to be worried about?",26
1,How does monetisation work?,4
1,i do want to know how to livestream on my PC is there a way to do so?,18
1,Hello! Trying to record within the app but it only let's  me for one minute? Was wondering if there's a way to extend it or is that the limit?,29
1,"What are the symbols exactly? I understand the heart for likes, and the comment/share part but what’s the star and that other symbol that looks almost like a U?",29
1,"This is the problem with these algorithmic apps, is that people think their experience with these apps is the universal experience. 

Because my TikTok experience had ZERO short, snappy videos, NO dances, trends, and very little memes. 

My TikTok experience had far more lifestyle tips, product reviews, personal stories, and educational content.",52
1,Thank you so much!!!! This will be so helpful as an American refugee from TikTok,15
1,Can you get monetized on Rednote?,6
1,"Living in the US, are we able to shop on rednote? 
Do they ship to the US and how do we connect a payment",24
1,"Welcome all guys to Rednote! BTW, I’m looking for language exchange friends. If you have any questions about learning Chinese, DM",21
1,"Thank you for the help. How do I add/search for songs though? The App seems to only have casual music not music from artists and singers? 
I'm a singer and I'm not sure how to post my own music on there.. should I post clips or entire music videos?",49
1,How do I change the language to strictly English or can’t it be done?,14
1,Can you post a translation of the terms of service please? A lot of people (including myself) probably don't even know what they are.,24
1,I’ve built a small tool to help download videos from RedNote. I hope some of you might find it useful! Feel free to check it out here: \[RednoteVideoDownload.com\](https://rednotevideodownload.com/ ). Let me know if you have any feedback!,37
1,"Can someone help me I'm trying to update my profile but I keep getting this pop up and it won't let me edit anything

https://preview.redd.it/ooin9ippvhde1.png?width=720&format=png&auto=webp&s=a7a614dba8d54adfaccc3028774a797350276e9d",25
1,I’ve been struggling with views and at the very maximum level out at 50-100 views. I’ve used popular and niche hashtags related to my post. Is there anything else I can do to improve my engagement? Thank you 🙏,39
1,Anyone knows about if Rednote has it own Tiktok Shop? A name AllValue came to my attention,17
1,Hi! Is there a way to have what I type in English on comments and captions automatically translated to mandarin on the app? Or do I need to translate it online first? Thanks!,33
1,Can't do it now. They're hacking and kicking foreigners off the platform. ,12
0,Do you know if U.S. advertisers are allowed on RedNote? Has anyone seen any ads yet?,16
15,"Xiaohongshu’s traffic algorithm naturally gives new users a bit of an advantage, offering them extra exposure. This means if you have a new account, you can leverage this initial boost by posting more high-quality content right from the start, increasing the chances of attracting followers and engagement. Consistency and value in your posts will help establish a strong foundation on the platform, allowing you to grow quickly and gain visibility among the community.",73
9,"Hi what's your ID, I'd like to be your first follower, love from china",14
9,"I haven't even been able to get past typing my number in... maybe too many people are trying to access the platform? not sure, but it's not working for me :(",31
3,omg does anyone else have any tips for this it's also not working for me,15
3,I wasn’t getting the code text but when I tried to post something it asked again and sent it instantly to me.,22
2,this didnt work for me 😭 gonna try again in 20 minutes because it seems like the timer stops when i click off of the app 🤞,27
2,I had to use canadian (1) for my number and it gave me a verification code instantly.,17
4,"Ensure perfect puzzle alignment, or switch network/devices if it still fails.",11
2,It does nothing when I try to drag or spin or click.,12
1,"You can share your tool, **Rednote Preview**, in the monthly thread. It’s a great way to introduce it to the community and get valuable feedback.",25
17,bold of you to assume your information isn't already in the air,12
12,My personal info is literally everywhere in the U.S. Data leaks from major companies have my social security number plastered in a thousand places by now. What’s China actually going to do to me if they have my data?,39
1,True,1
3,Same 😭,2
2,"It looks like your video exceeds the app's current upload limits. Based on the [Xiaohongshu Creator Platform](https://creator.xiaohongshu.com/) guidelines:

1. **File Size:** Videos can be up to **20GB** in size.
2. **Duration:** Videos must be **60 minutes or shorter**.
3. **Format:** Supported formats include **MP4** and **MOV** (MP4 is recommended).
4. **Resolution:** Videos should be **720P (1280x720)** or higher. For **1080P or above**, uploading via the **web platform** is recommended for better quality.

Since your 8K video is 700MB, the issue might not be the size alone but possibly the resolution or the platform you're using to upload. Try scaling it down to **1080P** and upload through the web platform for the best results",113
1,"thank you for the offer: is there a web portal for rednote? i have hard time using my phone to enter things in, and my mandarin is abysmal! i want to make sure i use captions and other stuff correctly!",40
1,"Join Red Note's official brand partnership or affiliate programs. Once approved, simply tag products in your posts using the “Add Product Tag” feature, and you’ll earn commissions from purchases made through those tags.",33
1,"There is a public market you need to go to pick. When you picked up some, you can attach them on your posts.",23
2,Xiaohongshu displays users' IP addresses to indicate their approximate location for transparency and authenticity.,14
2,Yes same,2
2,Try again later it’s just overloaded,6
2,"Yup, no chance.",3
1,"You need to switch in the settings, the path is: Me -> There's a settings button on the far right in the center of the screen -> General Settings -> Languages",31
3,"Not exactly. On Xiaohongshu, content creators don't get paid directly for views or engagement like TikTok's creator fund. However, many creators monetize their content through brand collaborations, affiliate marketing, or by promoting their own products. Xiaohongshu is heavily focused on e-commerce and lifestyle, so if your posts resonate with the audience, brands may reach out for partnerships, or you can use the platform to drive sales.",66
2,"Yes, you can repost your TikTok vlogs on Rednote, but keep in mind that cursing may not align well with the overall tone of the Xiaohongshu audience. Xiaohongshu typically leans toward a more polished and positive vibe. If you feel the language might be too harsh, consider editing or bleeping out some of the curses to make the content more appealing to that platform's audience.",65
1,Consider that China is socially conservative and that the users are 70% female.  Be polite.,15
1,"Xiaohongshu (Rednote) does have certain data collection practices, like many other apps, which may include device information such as IMEI numbers. IMEI collection is often used for device identification and fraud prevention, but it can raise privacy concerns if you’re uncomfortable with apps accessing such data.

If you're concerned about this:

1. **Check Permissions:** Review the app's permissions before downloading.
2. **Privacy Policy:** Read Xiaohongshu’s privacy policy to understand how your data is used.
3. **Alternative Measures:** Use app stores with strict privacy guidelines, such as the Apple App Store or Google Play, which vet apps for compliance.",98
1,"Monetization on Xiaohongshu (Little Red Book) typically works through influencer marketing, affiliate programs, and selling products directly via the platform's e-commerce features. Here's how it generally breaks down:

1. **Sponsored Content**: Brands collaborate with creators (KOLs) to promote products. Creators are paid based on their reach and engagement.
2. **Affiliate Links**: Some influencers earn commissions by sharing product links that track sales driven by their posts.
3. **E-commerce Stores**: Users can open shops to sell products directly on the platform.
4. **Traffic Diversion**: Creators drive traffic to other platforms (e.g., Taobao or WeChat) to monetize outside Xiaohongshu.",97
1,"**Heart**: Like the post.

**Comment bubble**: Open the comments section.

**Arrow**: Share the post to friends or other platforms.

**Star**: Save the post to your personal collections for future reference.

**U-shaped icon (Shopping bag)**: Indicates products featured in the post. Clicking it lets you view and buy the products directly.",50
1,"As a singer, you can upload your own music by creating engaging content:

* **Clips**: Short clips (15-30 seconds) tend to perform better for engagement. Showcase highlights of your songs or a teaser.
* **Music Videos**: If you have an aesthetic or storytelling element, post a full music video and promote it through appealing hashtags and captions.",57
2,"[ TOS official Enligsh Ver. (JAN 19th,2025)](https://agree.xiaohongshu.com/h5/terms/ZXXY20220331002/-1)",7
1,[https://www.reddit.com/r/rednote/s/bmsIuejBPD](https://www.reddit.com/r/rednote/s/bmsIuejBPD),1
1,you have to put your phone number in first,9
1,"It sounds like you're doing a lot of the right things, but here are a few tips to further boost your engagement:

1. **Post Consistency**: Make sure you're posting consistently at peak times, typically during the evenings or weekends when users are most active.
2. **Engaging Content**: Focus on making your content more interactive. Ask questions, add calls to action, or encourage users to comment.
3. **Collaborations/Challenges**: Collaborate with influencers or participate in trending challenges that align with your niche.
4. **Content Quality**: Ensure your visuals are high-quality, and your captions are engaging and relatable.",95
1,"To improve your engagement, consider these strategies:

1. **Post Timing**: Ensure you're posting when your audience is most active. Check your analytics (if available) to find the best times.
2. **Captivating Captions**: Write engaging captions that encourage interaction, like asking questions or creating curiosity.
3. **High-Quality Visuals**: Make sure your content is visually appealing and stands out. Aesthetic videos and images tend to perform better.
4. **Consistency**: Try to post regularly to build a consistent presence. The more you post, the higher the chances for your content to be discovered.",90
3,okay! thanks for your tips and advice!!!,7
2,But I made three posts and they didn’t get any views,11
2,D：95430534301,1
7,"ok, update. wifi was blocking it. i can access it using normal cell data.  maybe this will help someone else!",20
0,[deleted],1
1,"it's def super inconsistent.  i had the same issue, wouldn't get it, and then finally I did!",17
3,Thank you but I’ve tried that. When I press on it it opens tries to save it to photos. How do you physically align it?,25
2,Same.,1
1,Thanks for the tip!,4
1,"Advertising and Sales Department: Boss, why is this purchased leaked number from the United States? The phone charges are quite expensive. Could you reimburse me for the phone charges?:>",29
3,"Someone in the comments said take it off Wi-Fi.  I maxed out my chances for 24 hrs, but I'm going to try again tomorrow. I already made a video using the one phrase I learned, saying Hello everyone in Mandarin.",40
2,That's OK to use web to login your rednotes.😀,9
1,How do you find their affiliate programs?,7
1,Thank you so much for your insights :)!,8
